{
  "runId": "20260514T080014.889Z-4d0d436f-en-hemsida-f-r-en-ishock-00cbf5",
  "policyVersions": {
    "engineRun": "engine-run.v1",
    "namingDictionary": "naming-dictionary.v1",
    "scaffoldContract": "scaffold-contract.v1",
    "capabilityMap": "capability-map.v1",
    "llmModels": "llm-models.v1"
  },
  "siteBriefRef": "site-brief.json",
  "sitePlanRef": "site-plan.json",
  "scaffoldId": "local-service-business",
  "variantId": "nordic-trust",
  "starterId": "marketing-base",
  "language": "sv",
  "engineMode": "init",
  "createdAt": "2026-05-14T08:00:22+00:00"
}
